{"schema_version":"oaw.host-conformance-transcript/v4","session":{"schema_version":"oaw.host-session/v3","host_id":"codex","integration_id":"oaw/codex-host","integration_version":"2.0.0","session_id":"session-codex-conformance","manifest_digest":"6e490ff70bbcf3e92210cfb4f0429f4ceca6147079a5d1f1f18c3a7612820b99","supported_topologies":["CURRENT"],"provider_inventory_digest":"b57792ef07847e1340d7d6aa5a6aa68166dd7f1aeb66c4213cb733ac2bd2c010","feature_observations":[{"feature":"child-delegation","state":"available","source":"native-api","evidence_reference":"evidence://codex-host/conformance/subagent-start","digest":"0b0660b877fed33aa4691110955ad97a4c98b80fdebe715716cb015705110e1c"}],"feature_digest":"4885e521a76d15a63cdf021b759f0c219b3f0dbb02fd65af72193c9d72ab422c","host_action_observations":[],"host_action_digest":"ffb602f33b29bea9a34ee4efb2156a1d3898377354b3095a4629c94752b5c23a","environment_report_digest":"a71c20614fcca051a4ad250850365e7514fb07e38948c1fe63444ede5fc00c95","sandbox_policy_digest":"","approval_policy_digest":"","digest":"d754de72c6adf6f1322923e7ed8513db4860cbe55a23389455e6d5ca925ea5a3"},"inventory":{"schema_version":"oaw.host-binding-inventory/v3","host_id":"codex","observations":[{"host_id":"codex","provider_id":"oaw/conformance-fixture","installation_key":"installation-codex-conformance","distribution_id":"fixture","binding_id":"skill","surface":"codex","kind":"skill","reference":"fixture:skill","invocation":"model","binding_tree_digest":"sha256:aaaaaaaaaaaaaaaaaaaaaaaaaaaaaaaaaaaaaaaaaaaaaaaaaaaaaaaaaaaaaaaa","topologies":["CURRENT"],"source":"native-api","evidence_reference":"evidence://codex-host/conformance/skill-binding","digest":"533aabe880381a358627a8eb3414bdd367a18b41e987e51e8033c54c1e6e2e79"}],"digest":"b57792ef07847e1340d7d6aa5a6aa68166dd7f1aeb66c4213cb733ac2bd2c010"},"environment_reports":[{"schema_version":"oaw.host-environment-report/v2","session_id":"session-codex-conformance","parent_session_id":"","topology":"CURRENT","observations":[],"digest":"a71c20614fcca051a4ad250850365e7514fb07e38948c1fe63444ede5fc00c95"}],"receipts":[{"schema_version":"oaw.host-invocation-receipt/v3","kind":"COMPLETED","workflow_id":"workflow-0123456789abcdef0123456789abcdef","bundle_id":"bundle-0123456789abcdef0123456789abcdef","bundle_generation":1,"bundle_digest":"bbbbbbbbbbbbbbbbbbbbbbbbbbbbbbbbbbbbbbbbbbbbbbbbbbbbbbbbbbbbbbbb","cursor":{"slot_id":"fresh-verification","kind":"binding","unit_id":"skill","ordinal":1},"topology":"CURRENT","host_session_digest":"d754de72c6adf6f1322923e7ed8513db4860cbe55a23389455e6d5ca925ea5a3","dispatch_digest":"cccccccccccccccccccccccccccccccccccccccccccccccccccccccccccccccc","invocation_handle":"","context_freshness":"shared","environment_report_digest":"a71c20614fcca051a4ad250850365e7514fb07e38948c1fe63444ede5fc00c95","outcome":"succeeded","failure_code":"","outputs":[{"artifact_id":"workflow-output","schema":"oaw.workflow-artifact/v1","reference":"artifact://codex-host/conformance/output","digest":"eeeeeeeeeeeeeeeeeeeeeeeeeeeeeeeeeeeeeeeeeeeeeeeeeeeeeeeeeeeeeeee"}],"evidence":[{"kind":"report","reference":"evidence://codex-host/conformance/current-completion","digest":"dddddddddddddddddddddddddddddddddddddddddddddddddddddddddddddddd"}],"digest":"48687f432cd39d50b06bee67a0e07ba666618c09a380a09ec90e8b5a2b7449b4"}],"invocations":[],"digest":"79ff61fd82368fb45f191336b871d88fdc11dc1803bee1d2962c21365916c38e"}
